UPDATING THE PASSWORD:

OLD DATA:

SELECT * FROM students WHERE (email="suguram@gmail.com" and password="sugu_123");

+----+---------+-------------------+------------+----------+--------+------------+---------------------+
| id | name    | email             | mobile_no  | password | gender | dob        | created_date        |
+----+---------+-------------------+------------+----------+--------+------------+---------------------+
|  1 | Suguram | suguram@gmail.com | 9876543211 | sugu_123 | M      | 2002-04-10 | 2022-03-01 17:29:55 |
+----+---------+-------------------+------------+----------+--------+------------+---------------------+

1 row in set (0.00 sec)

NEW DATA:

UPDATE students SET password="sugu_12" where id="1";

Query OK, 1 row affected (0.01 sec)

SELECT*FROM students WHERE (name="Suguram");

+----+---------+-------------------+------------+----------+--------+------------+---------------------+
| id | name    | email             | mobile_no  | password | gender | dob        | created_date        |
+----+---------+-------------------+------------+----------+--------+------------+---------------------+
|  1 | Suguram | suguram@gmail.com | 9876543211 | sugu_12  | M      | 2002-04-10 | 2022-03-01 17:29:55 |
+----+---------+-------------------+------------+----------+--------+------------+---------------------+

1 row in set (0.01 sec)

HERE THE PASSWORD IS UPDATED FORM "sugu_123" TO "sugu_12"